{
  "schema": "liblevenshtein.causal-construction.v1",
  "domain": "unicode",
  "constructor": "from_terms",
  "term_count": 25000,
  "semantic_term_count": 25000,
  "semantic_membership_checks": 25000,
  "semantic_checksum_hex": "481ddb30b4ece2e5",
  "warmups": 5,
  "samples_ns": [
    5085693,
    5276306,
    5253752,
    5215400,
    5196244,
    5084381,
    5080002,
    5151708,
    5184080,
    5160175,
    5138383,
    5188278,
    5301653,
    5193808,
    5100882,
    5154654,
    5145006,
    5085983,
    5110791,
    5216642,
    5188529,
    5099139,
    5157179,
    5172258,
    5146689,
    5178369,
    5110320,
    5293208,
    5202696,
    5176576
  ],
  "cell": "unicode-mixed-25k-shuffled",
  "order": "shuffled",
  "dictionary": "unicode-mixed-25k-shuffled.txt",
  "dictionary_sha256": "0c1fcffb65ed6e6be937ba0a8818197c2b544cf8dd161ca0cc294f5b24ce4e09",
  "queries": "unicode-mixed-25k-shuffled-queries-std-d2.txt",
  "queries_sha256": "7bb623778090da5e32f4f7ca3b1a91e8e9a4e36e9c3fcaef867095fd219752e4",
  "binary_sha256": "342024688d547867b6233ce9be2083b10db36a59ad0eed678e5b85f6a7c90911"
}
