{
  "schema": "liblevenshtein.causal-construction.v1",
  "domain": "byte",
  "constructor": "from_sorted_terms",
  "term_count": 25000,
  "semantic_term_count": 25000,
  "semantic_membership_checks": 25000,
  "semantic_checksum_hex": "2907e5a462d19611",
  "warmups": 5,
  "samples_ns": [
    15215030,
    15087969,
    15054436,
    15094752,
    15368502,
    15139497,
    15145338,
    15127614,
    15086506,
    15151239,
    15090794,
    15078411,
    15084563,
    15142272,
    15060757,
    15119969,
    15055748,
    15087508,
    15140569,
    15072660,
    15252221,
    15135148,
    15168331,
    15048093,
    15137614,
    15106113,
    15143354,
    15112676,
    15253614,
    15155247
  ],
  "cell": "suffix-heavy-25k-sorted",
  "order": "sorted",
  "dictionary": "suffix-heavy-25k-sorted.txt",
  "dictionary_sha256": "909c22ae53ee61ab5bb3bbc720cc561ba26de3896289a46415038c2aa208e86e",
  "queries": "suffix-heavy-25k-sorted-queries-std-d2.txt",
  "queries_sha256": "6fee79f81faa84790c1963f58c8f795d0185d1d099a68814ef22ae0e445c2f7a",
  "binary_sha256": "342024688d547867b6233ce9be2083b10db36a59ad0eed678e5b85f6a7c90911"
}
