{
  "schema": "liblevenshtein.causal-construction.v1",
  "domain": "u64",
  "constructor": "from_terms",
  "term_count": 79343,
  "semantic_term_count": 79343,
  "semantic_membership_checks": 79343,
  "semantic_checksum_hex": "6e708412fe382b7b",
  "warmups": 5,
  "samples_ns": [
    10362870,
    10394009,
    10357500,
    10401453,
    10367809,
    10379872,
    10355566,
    10347581,
    10352531,
    10338935,
    10505010,
    10375504,
    10376486,
    10402325,
    10417403,
    10378400,
    10387486,
    10369874,
    10405471,
    10400762,
    10441209,
    10385814,
    10425740,
    10559443,
    10336700,
    10362920,
    10341740,
    10350987,
    10345567,
    10381766
  ],
  "cell": "u64-anchor-full-shuffled",
  "order": "shuffled",
  "dictionary": "u64-anchor-full-shuffled.txt",
  "dictionary_sha256": "95f03c55a158ea8efad98266a9ff0aa1675d88c4a6f2deff7106db1968d6c6ac",
  "queries": "u64-anchor-full-shuffled-queries-std-d2.txt",
  "queries_sha256": "2c3af9b4809c613f1dc08968d92b65db078a6d47dde0bcb7cd86f5738c4cf0f2",
  "binary_sha256": "342024688d547867b6233ce9be2083b10db36a59ad0eed678e5b85f6a7c90911"
}
