{
  "schema": "liblevenshtein.causal-construction.v1",
  "domain": "byte",
  "constructor": "from_terms",
  "term_count": 10000,
  "semantic_term_count": 10000,
  "semantic_membership_checks": 10000,
  "semantic_checksum_hex": "a1fafeb00897c818",
  "warmups": 5,
  "samples_ns": [
    4311914,
    4325640,
    4338694,
    4349215,
    4315560,
    4345327,
    4340719,
    4348814,
    4354314,
    4341489,
    4368260,
    4334015,
    4348964,
    4336360,
    4363983,
    4342181,
    4384030,
    4428164,
    4365896,
    4365695,
    4361909,
    4338193,
    4324106,
    4300081,
    4352962,
    4345517,
    4325168,
    4374643,
    4418416,
    4345387
  ],
  "cell": "anchor-10000-shuffled",
  "order": "shuffled",
  "dictionary": "anchor-10000-shuffled.txt",
  "dictionary_sha256": "626833c2ea0ba2450dc7c3ea2a71d4b0893381ea2e2f9e896af2ef64d31a00ff",
  "queries": "anchor-10000-shuffled-queries-std-d2.txt",
  "queries_sha256": "95a6b21f262d8d79a0eeee16954efbde9fa26c49af06c08e86671fabaea7cc00",
  "binary_sha256": "342024688d547867b6233ce9be2083b10db36a59ad0eed678e5b85f6a7c90911"
}
